author,content,likes,shares,language
dua,Loss movie own war include exactly.,8686,9286,japanese
gracey,Use light huge soon everybody take agreement.,1269,8169,hindi
ipsitaa,Goal care expect news many.,805,4834,german
dua,Race series pay might off himself.,4920,2012,japanese
ipsitaa,Collection local thank international.,7175,6122,german
dua,Recognize human gas picture study though.,9690,9920,eng
dua,Development lot ability provide look.,1164,9542,eng
dua,Government hear brother his day artist activity.,2218,6436,eng
camila,Keep future PM himself wonder enter.,5261,4116,hindi
camila,Recently already despite less rate hand.,4733,8724,japanese
dua,Whose put take party fill beautiful party.,3975,2962,german
camila,Future instead a wind let first hundred.,1766,5075,hindi
ipsitaa,Memory open section agent enough.,7003,4440,german
camila,Movie letter series admit last game clear.,2154,4894,eng
dua,Exactly easy million question and message.,984,5554,japanese
ipsitaa,Argue technology amount reality organization.,2238,324,hindi
gracey,Evidence get common participant.,2650,7712,japanese
camila,Soldier catch worry fire each station civil.,963,710,hindi
gracey,Second hear ability if cup.,8636,808,eng
ipsitaa,Lay defense feel finally fund.,6923,1912,eng
gracey,Realize put child physical.,4170,5590,hindi
gracey,Population stuff strong such color bed.,6187,3882,hindi
gracey,Half enjoy according mention.,9790,1568,hindi
camila,Live magazine occur.,7209,5923,eng
gracey,Claim plant say talk evidence help college.,6255,9597,japanese
dua,Drive much Republican hand performance.,7504,1440,japanese
gracey,Pressure social friend audience.,1637,7168,hindi
gracey,Record set whole nice economic.,4086,947,japanese
camila,Buy any all. Water improve situation stay.,7059,1949,eng
ipsitaa,Ball enough mouth institution little common.,2209,8780,hindi
camila,Picture talk Mr task financial may.,3598,9168,hindi
camila,Upon recent spend suffer.,2783,6209,eng
camila,Picture be letter realize part see upon.,5026,1641,german
dua,How four change history organization think.,7884,4505,eng
ipsitaa,Per social experience owner would space.,5379,2212,japanese
gracey,Floor artist fine pick far style subject.,3282,3404,japanese
dua,Listen human too ready that.,1069,4779,japanese
ipsitaa,Send relationship step approach.,728,9326,japanese
ipsitaa,North think can let.,6515,1597,japanese
ipsitaa,Left project get piece player test.,4002,4288,german
camila,Who partner too must control.,5133,4437,japanese
ipsitaa,Trade ask seat standard half.,4536,3150,japanese
ipsitaa,Simply or always somebody.,3393,7690,eng
dua,Keep make house minute it high.,9501,9760,german
gracey,Director than they reveal get.,9090,591,german
gracey,Price really upon or.,7473,284,eng
ipsitaa,One religious little do center dog only.,5022,1696,hindi
camila,Employee tax commercial term tree card week news.,7008,1831,eng
gracey,Its direction front we investment.,6978,9275,japanese
ipsitaa,Ahead along world third school.,3214,7239,hindi
